<?xml version="1.0" encoding="UTF-8"?>
<tech xmlns:xsi="http://www.w3.org/2001/XMLSchema-instance" xsi:noNamespaceSchemaLocation="../../schemas/tech.xsd">
	<item id="Fighter1" name="tech.fighter1.name" long-name="tech.fighter1.longname" description="tech.fighter1.description" category="SPACESHIPS_FIGHTERS" image="inventions/spaceships/fighters/fighter_1" factory="spaceship" research-cost="3000" production-cost="2000" level="0" race="human" ai="1" mil="1" index="0" video="technology/spaceships/fighters/fighter_1">
		<slot-fixed id="Laser" count="1" item="Laser1"/>
	</item>
	<item id="Fighter2" name="tech.fighter2.name" long-name="tech.fighter2.longname" description="tech.fighter2.description" category="SPACESHIPS_FIGHTERS" image="inventions/spaceships/fighters/fighter_2" factory="spaceship" research-cost="4000" production-cost="3200" level="2" race="human" mech="1" ai="1" mil="1" index="1" video="technology/spaceships/fighters/fighter_2">
		<slot-fixed id="Laser" count="2" item="Laser1"/>
	</item>
	<item id="Fighter3" name="tech.fighter3.name" long-name="tech.fighter3.longname" description="tech.fighter3.description" category="SPACESHIPS_FIGHTERS" image="inventions/spaceships/fighters/fighter_3" factory="spaceship" research-cost="12000" production-cost="5000" level="3" race="human" mech="1" comp="2" ai="2" mil="2" index="2" video="technology/spaceships/fighters/fighter_3">
		<slot-fixed id="Laser" count="2" item="Laser2"/>
	</item>
	<item id="Fighter4" name="tech.fighter4.name" long-name="tech.fighter4.longname" description="tech.fighter4.description" category="SPACESHIPS_FIGHTERS" image="inventions/spaceships/fighters/fighter_4" factory="spaceship" research-cost="18000" production-cost="7500" level="4" race="human" requires="Fighter3" mech="3" comp="2" ai="2" mil="4" index="3" video="technology/spaceships/fighters/fighter_4">
		<slot-fixed id="Laser" count="2" item="Laser2"/>
	</item>
	<item id="Fighter5" name="tech.fighter5.name" long-name="tech.fighter5.longname" description="tech.fighter5.description" category="SPACESHIPS_FIGHTERS" image="inventions/spaceships/fighters/fighter_5" factory="spaceship" research-cost="22000" production-cost="10000" level="4" race="human" civil="1" mech="5" comp="4" ai="4" mil="5" index="4" video="technology/spaceships/fighters/fighter_5" requires="Fighter4">
		<slot-fixed id="Laser" count="2" item="Laser3"/>
	</item>
	<item id="Fighter6" name="tech.fighter6.name" long-name="tech.fighter6.longname" description="tech.fighter6.description" category="SPACESHIPS_FIGHTERS" image="inventions/spaceships/fighters/fighter_6" factory="spaceship" research-cost="24000" production-cost="12000" level="5" race="human" requires="Rocket2,Fighter5" mech="4" comp="4" ai="5" mil="7" index="5" video="technology/spaceships/fighters/fighter_6">
		<slot-fixed id="Laser" count="2" item="Laser3"/>
	</item>
	<item id="Destroyer1" name="tech.destroyer1.name" long-name="tech.destroyer1.longname" description="tech.destroyer1.description" category="SPACESHIPS_CRUISERS" image="inventions/spaceships/cruisers/destroyer_1" factory="spaceship" research-cost="10000" production-cost="12000" level="0" race="human" comp="1" ai="1" mil="1" index="0" video="technology/spaceships/cruisers/destroyer_1">
		<slot id="shield" x="109" y="58" width="26" height="12" max="1" items="Shield1, Shield2"/>
		<slot id="laser" x="163" y="46" width="16" height="15" max="6" items="Laser1, Laser2, Laser3"/>
		<slot id="hyperdrive" x="203" y="56" width="24" height="11" max="1" items="HyperDrive1, HyperDrive2"/>
	</item>
	<item id="Destroyer2" name="tech.destroyer2.name" long-name="tech.destroyer2.longname" description="tech.destroyer2.description" category="SPACESHIPS_CRUISERS" image="inventions/spaceships/cruisers/destroyer_2" factory="spaceship" research-cost="32000" production-cost="17500" level="3" race="human" requires="Laser2" mech="2" comp="1" ai="1" mil="2" index="1" video="technology/spaceships/cruisers/destroyer_2">
		<slot id="laser1" x="187" y="39" width="24" height="15" max="8" items="Laser1, Laser2, Laser3"/>
		<slot id="shield" x="149" y="61" width="21" height="12" max="1" items="Shield1, Shield2"/>
		<slot id="laser2" x="185" y="66" width="24" height="15" max="6" items="Laser1, Laser2, Laser3"/>
		<slot id="hyperdrive" x="218" y="57" width="28" height="18" max="1" items="HyperDrive1, HyperDrive2, HyperDrive3"/>
	</item>
	<item id="Destroyer3" name="tech.destroyer3.name" long-name="tech.destroyer3.longname" description="tech.destroyer3.description" category="SPACESHIPS_CRUISERS" image="inventions/spaceships/cruisers/destroyer_3" factory="spaceship" research-cost="44000" production-cost="22000" level="4" race="human" requires="Radar2, HyperDrive4, PlasmaCannon" mech="3" comp="4" ai="3" mil="4" index="2" video="technology/spaceships/cruisers/destroyer_3">
		<slot id="radar" x="55" y="38" width="28" height="17" max="1" items="Radar1, Radar2"/>
		<slot id="shield" x="87" y="47" width="30" height="11" max="1" items="Shield1, Shield2"/>
		<slot id="laser1" x="181" y="14" width="21" height="10" max="9" items="Laser1, Laser2, Laser3"/>
		<slot id="hyperdrive" x="207" y="58" width="27" height="22" max="1" items="HyperDrive1, HyperDrive2, HyperDrive3, HyperDrive4, HyperDrive5"/>
		<slot id="laser2" x="169" y="84" width="22" height="10" max="9" items="Laser1, Laser2, Laser3"/>
		<slot id="cannon" x="184" y="102" width="16" height="15" max="4" items="IonCannon, PlasmaCannon, ParticleCannon"/>
	</item>
	<item id="Cruiser1" name="tech.cruiser1.name" long-name="tech.cruiser1.longname" description="tech.cruiser1.description" category="SPACESHIPS_CRUISERS" image="inventions/spaceships/cruisers/cruiser_1" factory="spaceship" research-cost="24000" production-cost="15000" level="2" race="human" requires="Shield1" mech="1" comp="1" ai="1" mil="1" index="3" video="technology/spaceships/cruisers/cruiser_1">
		<slot id="shield" x="60" y="62" width="36" height="13" max="1" items="Shield1, Shield2, Shield3, Shield4"/>
		<slot id="laser" x="128" y="67" width="23" height="14" max="8" items="Laser1, Laser2, Laser3, Laser4"/>
		<slot id="cannon" x="150" y="42" width="33" height="17" max="2" items="IonCannon, PlasmaCannon, ParticleCannon"/>
		<slot id="radar" x="192" y="38" width="30" height="17" max="1" items="Radar1, Radar2"/>
		<slot id="hyperdrive" x="206" y="63" width="30" height="22" max="1" items="HyperDrive1, HyperDrive2, HyperDrive3, HyperDrive4"/>
	</item>
	<item id="Cruiser2" name="tech.cruiser2.name" long-name="tech.cruiser2.longname" description="tech.cruiser2.description" category="SPACESHIPS_CRUISERS" image="inventions/spaceships/cruisers/cruiser_2" factory="spaceship" research-cost="50000" production-cost="25000" level="4" race="human" requires="Shield2, Laser2, Radar2" mech="2" comp="3" ai="3" mil="4" index="4" video="technology/spaceships/cruisers/cruiser_2">
		<slot id="shield" x="57" y="71" width="40" height="19" max="1" items="Shield1, Shield2, Shield3, Shield4"/>
		<slot id="radar" x="123" y="75" width="28" height="12" max="1" items="Radar1, Radar2"/>
		<slot id="laser" x="161" y="65" width="26" height="17" max="13" items="Laser1, Laser2, Laser3, Laser4"/>
		<slot id="cannon1" x="168" y="45" width="40" height="13" max="3" items="IonCannon, PlasmaCannon"/>
		<slot id="cannon2" x="183" y="85" width="38" height="13" max="5" items="IonCannon"/>
		<slot id="hyperdrive" x="216" y="59" width="29" height="19" max="1" items="HyperDrive1, HyperDrive2, HyperDrive3, HyperDrive4, HyperDrive5"/>
	</item>
	<item id="Cruiser3" name="tech.cruiser3.name" long-name="tech.cruiser3.longname" description="tech.cruiser3.description" category="SPACESHIPS_CRUISERS" image="inventions/spaceships/cruisers/cruiser_3" factory="spaceship" research-cost="70000" production-cost="36000" level="5" race="human" requires="HyperDrive5,Shield2,Bomb2" civil="1" mech="4" comp="5" ai="4" mil="7" index="5" video="technology/spaceships/cruisers/cruiser_3">
		<slot id="laser" x="38" y="67" width="21" height="10" max="16" items="Laser1, Laser2, Laser3, Laser4"/>
		<slot id="shield" x="63" y="62" width="24" height="12" max="1" items="Shield2, Shield3, Shield4"/>
		<slot id="bomb" x="133" y="45" width="22" height="22" max="4" items="Bomb1, Bomb2"/>
		<slot id="rocket" x="153" y="72" width="25" height="14" max="4" items="Rocket1, Rocket2, MultiheadedRocket"/>
		<slot id="cannon1" x="180" y="58" width="17" height="14" max="10" items="PlasmaCannon, ParticleCannon, MesonCannon"/>
		<slot id="ecm" x="199" y="71" width="22" height="11" max="1" items="ECM1, ECM2"/>
		<slot id="cannon2" x="207" y="56" width="15" height="14" max="10" items="PlasmaCannon, ParticleCannon, MesonCannon"/>
		<slot id="hyperdrive" x="235" y="55" width="23" height="21" max="1" items="HyperDrive1, HyperDrive2, HyperDrive3, HyperDrive4, HyperDrive5"/>
	</item>
	<item id="Battleship1" name="tech.battleship1.name" long-name="tech.battleship1.longname" description="tech.battleship1.description" category="SPACESHIPS_BATTLESHIPS" image="inventions/spaceships/battleships/battleship_1" factory="spaceship" research-cost="100000" production-cost="80000" level="3" race="human" requires="OrbitalFactory" civil="1" mech="1" comp="1" ai="1" mil="1" index="0" video="technology/spaceships/battleships/battleship_1">
		<slot id="laser" x="45" y="53" width="21" height="10" max="14" items="Laser1, Laser2, Laser3, Laser4"/>
		<slot id="bomb" x="80" y="64" width="22" height="13" max="8" items="Bomb1, Bomb2"/>
		<slot id="rocket" x="115" y="65" width="23" height="17" max="6" items="Rocket1, Rocket2, MultiheadedRocket"/>
		<slot id="radar" x="140" y="17" width="15" height="11" max="1" items="Radar1, Radar2, Radar3"/>
		<slot id="cannon" x="143" y="57" width="15" height="13" max="8" items="IonCannon, PlasmaCannon"/>
		<slot id="storage" x="161" y="61" width="21" height="15" max="1" items="Storage1, Storage2"/>